pdf//ArtChain_Blockchain-Enabled_Platform_for_Art_Marketplace.pdf;It is expected to provide a complete solution towards these challenges by creating a new ecosystem for the art keeping, trading and transferring.;It is expected to provide a complete solution towards these challenges by creating a new ecosystem for the art keeping, trading and transferring.;This means that participants will have the opportunity to develop an extensive range of art-related applications for speciﬁc scenarios based on the foundation of ArtChain.;It is expected to provide a complete solution towards these challenges by creating a new ecosystem for the art keeping, trading and transferring.;[('blockchain', 52), ('art', 40), ('transaction', 37), ('artchain', 33), ('node', 33), ('system', 31), ('artwork', 28), ('trading', 27), ('datum', 26), ('contract', 25)];2019.0;In future, we plan to work on anti-counterfeiting for the original works of art by integrating with the smart modules of IoT, and activating relevant smart hardware and other functionality (e.g. positioning/location tracking) as required by artists or collectors.;"ArtChain: Blockchain-enabled Platform for Art Marketplace
Ziyuan Wang, Lin Yang, Qin Wang, Donghai Liu, Zhiyu Xu, Shigang Liu
Blockchain Innovation Centre
Swinburne University of Technology
Abstract—Blockchain is an emerging technology that has
the potential to revolutionize the global industry and create a
trusted relationship in a multi-party business network. There
are a number of practical use cases where blockchain has been
applied. One speciﬁc area is the Art industry, where it is a
natural ﬁt in the way that art forensics and transactions are
conducted, tracked and recorded. This motivates us to develop
the ArtChain platform to assist the Art Industry. In this paper,
we present ArtChain, which is an integrated trading system
based on blockchain. It includes the front end, the back end,
the services, the smart contract, the chain connection and the
deployment scripts from the bottom to the top. To the best of
our knowledge, this is the ﬁrst deployed blockchain-enabled
art trading platform in Australia. It provides a transparent
yet privacy-preserving, and tamper-proof transaction history
for registration, provenance, and traceability of art assets.
Our objective analysis and evaluation show that the ArtChain
platform is applicable and practical. For the interest of other
researchers, our system implementation related resources are
open-sourced on Github1.
I. INTRODUCTION
Blockchain, also known as distributed ledger technol-
ogy (DLT) [1], is designed to support veriﬁcation-driven
transaction services within a generally un-trusted ecosystem.
The design of blockchain technology ensures that no one
business entity can modify, delete, or even append any
record to the ledger without consensus from other network
participants, ensuring the immutability of data stored on the
ledger. Blockchain is now being used in several industry
applications such as blockchain-enabled traceability and
provenance for food safety [2] documentation and cross-
organization workﬂow management in trading and logistics
[3].
With $200 billion of annual trading, the art market is one
of the largest unregulated markets in the world, accounting
for one-third of the amount of crime just behind drugs and
guns [4]. Tens of millions of dollars are transferred with little
or no documentation and transparency. Current challenges
and issues in the art market are: (1) lack of transparency on
prices and ownership history (provenance) and inadequate
control of transaction data due to the information asymme-
try; (2) the authenticity and appraisal of high-value works of
art is difﬁcult; (3) lack of the value of artworks at the primary
art market and transparency trading at the secondary auction
market (both online and ofﬂine); (4) lack of recognition,
1https://github.com/ArtChainGlobal
public attention and care for a large number of artists; (5)
it is difﬁcult for the artists to get royalty payment from the
secondary market.
Blockchain technology possesses a natural ﬁt to improve
the transparency, keep records and reduce illicit activities
in the art market, due to its inherent properties [5] [6]. In
this paper, we present our project work, called ArtChain, a
blockchain-based art trading system, which has been piloted
and operated as a working product in practice. It is expected
to provide a complete solution towards these challenges by
creating a new ecosystem for the art keeping, trading and
transferring. ArtChain fundamentally builds up the underly-
ing architecture of blockchain to support a commercial-level
trading platform centered around art assets. The core value
proposition of the platform lies in:
• Privacy Protection Shared ledger along with permis-
sioned control ensures the transparency of each trans-
action which guarantees the privacy protection in art
trading and provenance.
• Traceability Real-time tracking of individual artworks
combined with the blockchain ledger assists in the ﬁght
against counterfeit artworks.
• Irreversibility The on-chain registration of collectors
ofﬂine assets provides an immutable digital record of
the artwork, which guarantees the true ownership, the
provenance and the value of the artwork.
• Transparency Publicly displaying artworks to a wider
range of professional investors, leveraging the openness
of art ecosystem.
II. BLOCKCHAIN SOLUTION TOWARDS ART TRADING
In this section, we start with the rationale behind the use
of blockchain for an art marketplace, and then discuss the
beneﬁts of this blockchain-enabled platform.
A. Rationale behind Using Blockchain
The major entities or participants in our solution are
described in the following.
• Artist Established artists along with new generation
artists all have equal opportunities for professional
evaluation and to publish their artworks. Published
items will be available for trade.
• Art gallery After artwork is registered on the blockchain
system, it can be tracked and located in real-time giving
an additional level of security to galleries.
447
2019 IEEE International Conference on Blockchain (Blockchain)
978-1-7281-4693-5/19/$31.00 ©2019 IEEE
DOI 10.1109/Blockchain.2019.00068
Authorized licensed use limited to: UNIVERSIDADE ESTADUAL DE MARINGA. Downloaded on July 14,2025 at 16:59:39 UTC from IEEE Xplore.  Restrictions apply. 
'%-""
()')%$
%$
	)""(
('#$'%$)
$

		

'$
')$
%"""")%$
')
,"""")

%$)$)
')+%'!$#$)
()'
""(
+$'(&'-)%$
+$'(&$$
%&&$$
"""")$#$)
""$
'$('
'$()%$
)'+

		

%""
%,""%""
+'$
%$)'%""""'
 (
#')%$)')

)'*#
Figure 1.
System architecture
• Auction house Data stored on blockchain can be syn-
chronized with auction houses, opening up new chan-
nels for a greater global audience participation. More
trafﬁc equals more opportunities for all involved.
• Collector Online synchronization of collectors ofﬂine
art assets. This proves ownership and sets the prove-
nance of the pieces for future generations ensuring the
value is preserved. Access to a global database with
extensive ﬁltering capabilities.
B. Beneﬁts of a Blockchain-enabled Art Marketplace
Firstly, the artwork authenticity and traceable data can be
simply achieved. Provenance is crucial when it comes to
collecting art. Not having a record of the ownership history
for a masterpiece often raises suspicion that it could be
stolen or fake, hence a distributed ledger can be used to trace
the transfer of ownership over a period of time, and serve as
a decentralized database securing provenance data and other
important information related to artworks. This allows for
quick and indisputable ownership transfer in trading.
Secondly, royalty payment from the secondary market for
artists can be achieved. A 5% royalty will be payable to
visual artists on certain commercial sales of their work. This
entitlement is created by the Resale Royalty Right for Visual
Artists Act 2009.However, due to the difﬁculty in tracking
the resales in the current art market, often artists do not
necessarily get the royalty [7].
Thirdly, Blockchain audit trail helps in detecting tax
evasion and money laundering. Add-on analytics or AI
services can predict the current value of an artwork based on
shared transparent data. This helps primary market valuation,
which is more difﬁcult and more speculative than secondary
market due to a lack of market history.
Furthermore, our solution is designed to become an open,
expandable infrastructure orientated towards the art industry.
This means that participants will have the opportunity to
develop an extensive range of art-related applications for
speciﬁc scenarios based on the foundation of ArtChain.
III. SYSTEM OVERVIEW
In this section, we ﬁrst present the foundational principles
the architecture is based on, the high-level architecture and
its main components. Then, we present basic data model
design and the trading process of the platform. In addition,
we discuss the trust and security issues.
A. High-level Architecture Design
We ﬁrst evaluate several blockchain platforms to inform
our decision on which platform to apply. Based on the
business requirements and technical assessment we decide to
use the Ethereum private blockchain and Proof of Authority
(PoA) [8] as the consensus algorithm. Initially, we consid-
ered to use Hyperledger Fabric to implement our system due
to its capability, popularity and maturity. However, it lacks
support in native token, which is a key business requirement
in our design as the art trading platform hopes to integrate
the payment process and the ownership transfer process. We
design and implement a utility token called ACGT to achieve
the high performance requirement. Refer to Section IV-A
Tokenization for more details.
Here, we adopt microservices architecture for the fol-
lowing beneﬁts: (1) Allows quick parallel development of
various components in the application landscape; (2) Re-
duces discussion time between various groups developing
various components; (3) When done properly, provides
clean reusable interfaces; (4) When done properly, reduces
handshaking in interfaces; (5) Reduces the risk and time of
integration/chain testing. The architecture design is shown
in Figure 1.
There are three layers in the system: the user front end,
the trading back end, and the ArtChain blockchain layer.
• User Front End: includes the following functions:
managing Proﬁle for user registration, login and user
details; displaying art Collection; shopping Cart; user
Wallet; and CMS (Content Management System) to
create and manage web content.
• Trading Back End: consists of Artwork Management,
Shopping/biding, and Wallet Management. Artwork
Management includes artwork registration, ownership
veriﬁcation and ownership transfer. Artists or collectors
conduct the registration of their artworks through the
assessment system of professional institutions within
ArtChain. Their works of art will then be eligible for
trading and participating in the ecosystem.
• ArtChain: including the following components: (1)
Royalty model: responsible for artists royalty payment
in the resale of their artworks. (2) POI model: manage
Proof of Interaction (POI) agreements, which are used
as incentives to grow the ecosystem of applications.
448
Authorized licensed use limited to: UNIVERSIDADE ESTADUAL DE MARINGA. Downloaded on July 14,2025 at 16:59:39 UTC from IEEE Xplore.  Restrictions apply. 
Figure 2.
Data model: User Class
More details are described in Section IV-A. (3)Re-
warding Controller: based on POI model to manage
the rewarding to participants. The details are business
conﬁdential information, which is out of the scope of
this paper.
B. Design of Data Model
There are three major groups of data objects stored in the
distributed ledger as illustrated as follow:
• User: contains all information related to a user’s proﬁle,
login, wallet, and auction events attended. An artist is
also a user, with additional information and veriﬁcation.
The detail is shown in Figure 2
• Artwork: consists of details, tag, history of ownership
transfer, and order details. These class represents the
workﬂow related to the masterpiece. The detail is
shown in Figure 3.
Figure 3.
Data model: Artwork Class
Figure 4.
Data model: Trading Class
• Trading: combines an order with the artwork and the
buyer’s basic information and the shipping address. The
detail is shown in Figure 4.
The trading process is shown in Figure 5. When the user’s
trading request is received, Proﬁle Services and Trading
Services are triggered to retrieve the customer info and
trade info. After checking the trading conditions, Payment
Services are responsible for handling payment. Then Reward
Services are called to request and receive the reward infor-
mation. In the end, Shipping Services handle the shipping
information.
C. Trust Establishment
ArtChain co-operates with specialized or high-proﬁle part-
ners in the primary or secondary markets of the art industry,
including museums, art galleries, and auction houses, to
establish the original ledger nodes and provide core func-
tions such as validating, ordering and generating blocks of
transactions. These ledger nodes and other agent or routing
nodes work together to protect the blockchain network.
We use Proof-of-Authority (PoA) as the trust model of
ArtChain network. PoA is well-suited to regulated industries
where entities are responsible for maintaining the network
(known as authorities), rather than remain anonymous as in
mining-based chains.
For our practical purpose, well-known museums and art
galleries are acting as authorities in ArtChain network to
conduct authenticity and price assessment for an artwork.
They are called SuperNode. Supernodes perform validating,
block generation and publishing.
449
Authorized licensed use limited to: UNIVERSIDADE ESTADUAL DE MARINGA. Downloaded on July 14,2025 at 16:59:39 UTC from IEEE Xplore.  Restrictions apply. 
%#""&$%
#%#
#%( ### $$ (
#'$
""&$%'
 # 
 !' 
	

	
# +
#'


$%#%
""&$%'
$!! 

""&$%'
%# 
""&$%'
&$% 
* #
#
#'
!!
#'
*%
#'
(#
#'
&&#
)!#$$

	
Figure 5.
Trading Process
Any node attempting to engage in malicious conducts
or falling under attack will be immediately detected by
other nodes in the network once it shows unusual behaviour
(e.g., sending illegal transactions, trafﬁc attacks, and data
tampering). The network will immediately isolate the partic-
ular node and send out warnings. ArtChain deploys ledger
nodes throughout the primary and secondary art markets,
including internet companies, cloud service providers and
a large number of collectors of works of art and artists,
which, from a probability point of view, can eliminate the
possibilities where the majority of nodes fall under attack
or collude to engage in malicious conducts.
Initially, we set up 100 nodes to provide sufﬁcient re-
dundancy and ﬁght against 51% attack. Currently, they are
deployed at AWS and Ali cloud and not activate all at the
same time. We monitor the nodes behaviour and dynamically
replace the crashed nodes. We plan to extend the deployment
to be more decentralized on other clouds. In this regard,
an important issue to consider is the trade-off between
decentralization and performance.
IV. SCALABLE BLOCKCHAIN IMPLEMENTATION
In this section, we present the implementation of ArtChain
network. We ﬁrst introduce tokenization and how it works
in our system. Then we describe the design and imple-
mentation of the upgradable smart contract for the purpose
of improving function and ﬁxing bugs. Finally, we discuss
how to preserve privacy and conﬁdentiality as required by
regulations and business needs.
A. Tokenizaiton
Tokenization refers to converting an asset into a digital
token on the blockchain system, so that ownership of the
asset can be transferred via smart contracts. Smart con-
tracts have functions for automatic transactions, formulas
for calculating asset prices and other speciﬁc features [9],
[10]. Tokenization is not simply the creation of a token.
Instead, it is about the design of the whole system, including
understanding the various rights and issues.
There are two types of token in ArtChain: the security
token ACG2 and the utility token ACGT.
ACG token comes with the essential technical features
of digital currencies, including a steady issue curve, free
trading, immunity to double-spending attacks, and traceable
transaction history. These features are secured through the
ledger architecture and smart contracts. We develop rele-
vant E-wallets for corporate or institutional users, which
incorporate all essential functions for interactions with the
applications on ArtChain.
ACG token provides incentives for maintaining the
ArtChain network and the ecosystem of ArtChain applica-
tions.
• Network Maintenance: the consistency of ArtChain net-
work is jointly assured by ledger nodes. Ledger nodes
will have the opportunity to be awarded with ACG
as block rewards and transaction fees, to encourage
them to contribute to the security and stability of the
ArtChain network.
• Ecosystem of Applications: ArtChain will award users
with newly added ACG in positive correlation within
a certain cycle based on a number of indicators such
as their frequency of interaction with the ArtChain
ecosystem, levels of contribution, inﬂuence and the
number of ACG coins they hold. All indicators of
ecosystem incentives are quantiﬁable and veriﬁable,
which are collected and calculated by ledger nodes.
Incentives will be allocated under Proof of Interaction
(POI) agreements.
The ratio of the incentives for ArtChain network main-
tenance and the incentives for the ecosystem of ArtChain
applications will be dynamically adjusted by using a negative
feedback mechanism to maintain the balance and stability of
the ArtChain network and the ecosystem of applications.
The speciﬁc indicators and algorithms will be published
before any main relevant applications go online, and will be
implemented and operated through open rules of contracts.
Relevant institutional users of the ecosystem (art galleries,
museums, auction houses and artists) will be consulted.
The utility token ACGT is only used internally to facilitate
payment in art trading. It is a kind of stable coins, which are
designed to have a stable price or value over a period of time,
therefore, less volatile. These coins aim to mimic the relative
price stability of ﬁat currencies on one hand, but keep the
core values of cryptocurrencies such as decentralization and
security, on the other hand. Each ACGT token is collateral-
ized by an equal amount of ﬁat currency (1 AUD) held by
2https://etherscan.io/token/0x984c134a8809571993fd1573fb99f06dc61e216f
450
Authorized licensed use limited to: UNIVERSIDADE ESTADUAL DE MARINGA. Downloaded on July 14,2025 at 16:59:39 UTC from IEEE Xplore.  Restrictions apply. 
	






	
	
	
	




	

			

		
	
			
	

	

				
	

Figure 6.
Zepplin proxy architecture pattern
a central custodian. Holders are guaranteed to redeem their
token at any point for the stable value denominated in ﬁat.
B. Upgradable Smart Contracts
Smart contract, once deployed into the blockchain, is
immutable literally. In consideration of bug ﬁx and function
improvement, lots of work has been done to propose an
upgradeable design pattern of the smart contract [11].
The typical methods include:
• Separate logic and data
• Partially upgradable smart contracts system
• Separate logic and data in key-value pairs.
• Eternal storage with proxy contract
Among these methods, the proxy mechanism is most
ﬂexible and guarantees a 100% upgradable mechanism i.e.,
the logic could be completely modiﬁed while remaining the
existing data state. In our system, we refer to Zeppelin’s
proxy patterns [12] and implement the so-called Unstruc-
tured Storage Pattern. The contract structure is shown in
Fig 6.
By using this pattern, the system achieves following
features:
• General user is unaware about upgrade of the contract.
• Implementation of logic contract is 100% upgradable.
• Data is stored in proxy contract. New data ﬁelds
could be added by the upgraded logic contract, without
touching existing data structure.
This design has also been chosen for the ZeppelinOS
smart contract system, and gone through a full security audit.
C. Initializing Issue
In our implementation, we also address the initializing
issue. This is a long-standing problem of upgradability solu-
tions for Ethereum. Our aim is to create an upgradable logic
contract, and we practically deploy a proxy contract which
delegates to a pre-existing deployment of logic contract on
the blockchain. Therefore the proxy contract has no chance
to establish the initializing steps in the constructor of logic
contract, and thus we need to do something special in order
to correctly initialize the proxy contract.
Our workaround for it is to use an initializer function
instead of the constructor, and make sure it is only executed
once for a necessary initializing process. Other proposals
could be found as Initializer Contracts [13] [14].
D. Safety Control
Transaction security: ArtChain network assures the se-
curity of users’ accounts and funds by using blockchain
consensus, digital signatures and end-users encrypted wal-
lets. The artwork trading platform provides security services
that are likened to those offered by ﬁnancial institutions. It
integrates data, applications and transactions in blockchain
clouds through the efﬁcient integration of data storage, net-
work and other resources, so as to create a secure transaction
environment.
Financial Management: ArtChain maintains high stan-
dards of integrity and ethical business conduct and is in
compliance with relevant laws and regulations, as well as
self-regulatory principles of the industry. We also implement
a component to conduct the regulatory duty of Know-You-
Customer (KYC).
E. Privacy and Conﬁdentiality
ArtChain makes public all ledger nodes and their state
in the network in real time. The transaction history (block
content) and state information in ArtChain are publicly vis-
ible. However, in case of any privacy requirements for some
transactions, such privacy information will be processed.
In the data model design, we carefully decide what data
to be stored on-chain and what off-chain. The design has
been evolved along business needs and regulatory needs.
Currently, the on-chain data store contains information on
artist, the hash of ownership, price, and history. The hash
of ownership protects the privacy for owners who do not
want to be known to the public, as well as in compliance
with privacy regulations, such as the General Data Protection
Regulation (GDPR)3.
V. PERFORMANCE EVALUATION
We conduct an extensive performance testing of the
system. We identify that the performance bottleneck of the
system is the low-level I/O efﬁciency of the Ethereum client,
i.e. Geth4 in our system.
ArtChain private chain, based on POA consensus and
5-second block interval and deployed on 6 cloud nodes
(8x2.5GHz CPUs, 32G memory), supports up to 1500 TPS,
i.e., 1500 raw transactions on the chain, far more superior to
Ethereum mainnet (about 15 TPS nowadays). Integrated user
actions, like post new artwork or top up tokens, are usually
comprised of a series of transactions/queries on the chain.
ArtChain on average processes about 40-70 user actions per
second.
3https://eugdpr.org/
4https://geth.ethereum.org/
451
Authorized licensed use limited to: UNIVERSIDADE ESTADUAL DE MARINGA. Downloaded on July 14,2025 at 16:59:39 UTC from IEEE Xplore.  Restrictions apply. 
A. Environment Setup
The private chain is composed of 3 Ali cloud servers (8x
2.5GHz CPUs, 32GB memory, 64GB hard disc), and 3 AWS
cloud servers (8x 2.5GHz CPUs, 32GB memory, 8GB hard
disc). Geth version 1.8.17, startup parameter is tuned as:
• --targetgaslimit 4294967295: increase the gas limit to
0xFFFFFFFF to seal as many transactions as in one
block. Note this need to coordinate with the gasLimit
in the genesis.json ﬁle when creating the chain.
• --txpool.lifetime 24h --txpool.accountslots 65536 --
txpool.globalslots 65536 --txpool.accountqueue 64 --
txpool.globalqueue 65536: increase txpool so that it
stores as many transactions both account speciﬁcally
and globally as we submitted.
This paper employ web3.js5 to communicate with the
chain, and to monitor its performance, Wireshark6 is applied
to capture packet for analysis.
B. Throughput Analysis
Basically, blockchain throughput is limited by: a) How
long it needs to generate a block, and b) How many
transactions can be sealed in a block. And theoretical
throughput = (number of transactions in a block)/(block
interval). But in a large-scale network, the throughput is
also restricted by the broadcast speed. An explicit example is
Ethereum mainnet, with network congestion, its throughput
dramatically degrades as nodes need more time to keep
